{
    "socket":"/home/kadisk/EcosystemData/sockets/ecosystem-instance-manager.app.sock",
    "serverName":"PlatformMainApplicationInstance",
    "ECO_DIRPATH_INSTALL_DATA":"/home/kadisk/EcosystemData",
    "REPOS_CONF_FILENAME_REPOS_DATA":"repositories.json",
    "REPOS_CONF_EXT_MODULE_DIR":"Module",
    "REPOS_CONF_EXT_LAYER_DIR":"layer",
    "REPOS_CONF_EXT_GROUP_DIR":"group",
    "REPOS_CONF_EXTLIST_PKG_TYPE":"app|webapp|webgui|webservice|service|lib",
    "PKG_CONF_DIRNAME_METADATA":"metadata",
    "EXECUTIONDATA_CONF_DIRNAME_DEPENDENCIES": ".dependencies",
    "ECOSYSTEMDATA_CONF_FILENAME_PKG_GRAPH_DATA": "metadata-hierarchy.json"
}